{
  "acceptance_tests": [
    {
      "assertions": [
        {
          "ids": [
            "K1",
            "K2",
            "K3",
            "K4",
            "K5",
            "K6",
            "K7"
          ],
          "kind": "kernel",
          "type": "exact_kind_ids"
        }
      ],
      "id": "AT-001",
      "rationale": "A faithful reconstruction must include all seven identity claims.",
      "title": "Kernel is complete and minimal"
    },
    {
      "assertions": [
        {
          "id": "K1",
          "kind": "kernel",
          "type": "node_exists"
        },
        {
          "id": "K2",
          "kind": "kernel",
          "type": "node_exists"
        },
        {
          "from": "K1",
          "to": "D4",
          "type": "path_exists"
        },
        {
          "from": "K2",
          "to": "D4",
          "type": "path_exists"
        }
      ],
      "id": "AT-002",
      "rationale": "K1 and K2 must jointly ground the hardware-entanglement mechanism.",
      "title": "Capability is not conflated with power"
    },
    {
      "assertions": [
        {
          "id": "K3",
          "kind": "kernel",
          "type": "node_exists"
        },
        {
          "from": "K3",
          "to": "I1",
          "type": "path_exists"
        }
      ],
      "id": "AT-003",
      "rationale": "The research/deployment distinction and external-agency boundary must both remain represented.",
      "title": "Research permission does not imply deployment permission"
    },
    {
      "assertions": [
        {
          "from": "K4",
          "to": "D2",
          "type": "path_exists"
        },
        {
          "from": "D2",
          "to": "I3",
          "type": "path_exists"
        },
        {
          "from": "D2",
          "to": "D3",
          "type": "path_exists"
        }
      ],
      "id": "AT-004",
      "rationale": "Removing rival review changes a central mechanism rather than a drafting detail.",
      "title": "Above-frontier release is adversarially gated"
    },
    {
      "assertions": [
        {
          "id": "K5",
          "kind": "kernel",
          "type": "node_exists"
        },
        {
          "id": "K6",
          "kind": "kernel",
          "type": "node_exists"
        },
        {
          "from": "K5",
          "to": "D6",
          "type": "path_exists"
        },
        {
          "from": "K6",
          "to": "D6",
          "type": "path_exists"
        }
      ],
      "id": "AT-005",
      "rationale": "The proposal must neither require a treaty first nor ignore foreign public releases.",
      "title": "Domestic entry and automatic reciprocity coexist"
    },
    {
      "assertions": [
        {
          "from": "K7",
          "to": "I2",
          "type": "path_exists"
        },
        {
          "from": "K7",
          "to": "I4",
          "type": "path_exists"
        },
        {
          "from": "K7",
          "to": "I5",
          "type": "path_exists"
        }
      ],
      "id": "AT-006",
      "rationale": "K7 must reach incident reporting, hardware reversibility, and industrial vetoes.",
      "title": "Warning time has legal, technical, and physical implementations"
    },
    {
      "assertions": [
        {
          "fields": [
            "falsifier",
            "evidence_needed",
            "stopping_rule"
          ],
          "kind": "hypothesis",
          "type": "all_kind_have_fields"
        }
      ],
      "id": "AT-007",
      "rationale": "Feasibility claims must expose evidence needs and stopping rules.",
      "title": "Foundational uncertainty remains falsifiable"
    },
    {
      "assertions": [
        {
          "field": "replaceable",
          "kind": "implementation",
          "type": "all_kind_field_equals",
          "value": true
        }
      ],
      "id": "AT-008",
      "rationale": "Optional policy choices must remain replaceable.",
      "title": "Implementation options cannot masquerade as kernel claims"
    },
    {
      "assertions": [
        {
          "type": "all_nodes_have_provenance"
        }
      ],
      "id": "AT-009",
      "rationale": "Every claim must expose responsibility and source lineage.",
      "title": "Provenance is proposition-level"
    },
    {
      "assertions": [
        {
          "path": "specification.authority.system",
          "type": "field_equals",
          "value": "git"
        },
        {
          "path": "publication.rendering_model.universal_type",
          "type": "field_equals",
          "value": "rendering"
        },
        {
          "path": "publication.verification_policy.attestation_must_name",
          "type": "collection_contains",
          "value": "full_target_git_commit"
        }
      ],
      "id": "AT-010",
      "rationale": "Branch movement or website drift must not alter the object that was rendered or verified.",
      "title": "Publication authority is commit-addressed"
    }
  ],
  "audit_events": [
    {
      "affected_nodes": [
        "H5"
      ],
      "confidence": "medium",
      "date": "2024-02-26",
      "evidence": [
        "SRC-PRODUCTIVITY-DEFLATION"
      ],
      "id": "EVT-2024-ECONOMIC-PRECURSOR",
      "phase": "precursor",
      "summary": "Productivity-deflation idea records adoption and investment effects of anticipated rapid improvement."
    },
    {
      "affected_nodes": [
        "K1",
        "K2",
        "K7",
        "H1",
        "I5"
      ],
      "confidence": "high",
      "date": "2025-10-02",
      "evidence": [
        "SRC-AI-BREAKOUT"
      ],
      "id": "EVT-2025-SAFETY-SPINE",
      "phase": "deep-inception",
      "summary": "AI Breakout separates intelligence from durable autonomy and identifies physical human vetoes."
    },
    {
      "affected_nodes": [
        "K1",
        "K2",
        "K7",
        "H1",
        "I5",
        "Q3"
      ],
      "caveat": "Recorded as convergent related work, not as origin provenance for the earlier AI Breakout formulation.",
      "confidence": "high",
      "date": "2026-06-18",
      "evidence": [
        "SRC-POTAPOV-OFF-EARTH"
      ],
      "id": "EVT-2026-OFF-EARTH-CONVERGENCE",
      "phase": "external-convergence",
      "summary": "Potapov independently frames staged off-Earth industrial autonomy as an exit option that can make early cooperation preferable to confrontation."
    },
    {
      "affected_nodes": [
        "K1",
        "K2",
        "K3",
        "K4",
        "K5",
        "D1",
        "D2",
        "D3"
      ],
      "caveat": "The phrase \"the gate that we've described\" implies an immediate precursor not preserved here.",
      "confidence": "high",
      "date": "2026-08-08",
      "evidence": [
        "SRC-TOBY-ORD"
      ],
      "id": "EVT-2026-POLICY-INCEPTION",
      "phase": "policy-inception",
      "summary": "Public-frontier gating, rival review, unilateral entry, and industrial vetoes appear together."
    },
    {
      "affected_nodes": [
        "K1",
        "K2",
        "K3",
        "K4",
        "K5"
      ],
      "caveat": "The initial August 17 file revision is not present in the available Git history.",
      "confidence": "medium",
      "date": "2026-08-17",
      "evidence": [
        "SRC-TOBY-ORD",
        "SRC-PAUSEAI"
      ],
      "id": "EVT-2026-NAMED-PROJECT",
      "phase": "named-project",
      "summary": "AI Pacing becomes a standalone Obsidian project."
    },
    {
      "affected_nodes": [
        "K1",
        "K2",
        "K3",
        "K4",
        "K5",
        "K6",
        "K7",
        "D1",
        "D2",
        "D3",
        "D4",
        "D5",
        "D6",
        "I1",
        "I2",
        "I3",
        "I4",
        "I5",
        "I6"
      ],
      "confidence": "high",
      "date": "2026-08-29",
      "evidence": [
        "SRC-AI-2040",
        "SRC-NGO",
        "SRC-DAVIDSON",
        "SRC-HUGGING-FACE",
        "SRC-PLAN-A-BARGAINING"
      ],
      "id": "EVT-2026-REGIME-ASSEMBLY",
      "phase": "regime-assembly",
      "summary": "Plan A, Ngo, Davidson, the Hugging Face incident, and author interjections are assembled into the current domestic-first regime.",
      "time": "12:55:54-05:00"
    },
    {
      "affected_nodes": [
        "K1",
        "K2",
        "K3",
        "K4",
        "K5",
        "K6",
        "K7"
      ],
      "confidence": "high",
      "date": "2026-08-29",
      "evidence": [
        "SRC-PLAN-A-BARGAINING"
      ],
      "id": "EVT-2026-CANONICAL-SPEC",
      "phase": "formalization",
      "summary": "The evolving essay is converted into a typed, dependency-aware canonical specification.",
      "time": "15:46:39-05:00"
    },
    {
      "affected_nodes": [
        "H14",
        "Q13"
      ],
      "caveat": "Recorded as proposed, not accepted. The issue's H6 and Q5 collided with editorial-reference IDs and were registered as H14 and Q13.",
      "confidence": "high",
      "date": "2026-09-10",
      "evidence": [
        "SRC-REED-EXTERNAL-SIGNAL",
        "SRC-ISSUE-1-SPOKEN-MARGINS"
      ],
      "id": "EVT-2026-EXTERNAL-SIGNAL-PROPOSAL",
      "phase": "proposal",
      "summary": "Issue #1 proposes external-signal dependence as a hypothesis and a staged human–AI autonomy bargain as an open question, after the Reed episode."
    },
    {
      "affected_nodes": [
        "H10",
        "D18",
        "I11",
        "Q11",
        "D19",
        "Q12"
      ],
      "caveat": "Recorded as proposed, not accepted. The Hugging Face worked example in the issue is provisional pending the source-grounded reconstruction in issue #15; see docs/proposed-extensions.md.",
      "confidence": "high",
      "date": "2026-10-21",
      "evidence": [
        "SRC-SPANIEL-WAR-ON-AI",
        "SRC-ISSUE-3-DIALOGUE",
        "SRC-OFF-EARTH-CLOSING-WINDOW-TEST"
      ],
      "id": "EVT-2026-RETROSPECTIVE-AUDIT-PROPOSAL",
      "phase": "proposal",